,article_id,category,title
945,sep-4996,technology,Attack prompts Bush site block
946,sep-3370,sport,Beckham relief as Real go through
947,sep-0503,sport,Beckham's chat reigns in Spain
948,sep-4426,sport,Blatter suggests offside change
949,sep-1785,sport,Bomb threat at Bernabeu stadium
950,sep-3918,sport,Bristol City 2-1 Milton Keynes
951,sep-0401,business,Cairn Energy in Indian gas find
952,sep-2816,sport,Campbell lifts lid on United feud
953,sep-3016,technology,Can Yahoo dominate next decade?
954,sep-2767,business,Cars pull down US retail figures
955,sep-4852,sport,Chelsea 3-0 Portsmouth
956,sep-1803,sport,Chepkemei hit by big ban
957,sep-0386,business,Chinese dam firm 'defies Beijing'
958,sep-3587,technology,Concern over RFID tags
959,sep-1349,sport,Davenport puts retirement on hold
960,sep-3570,business,Dollar hits new low versus euro
961,sep-4970,technology,Domain system opens door to scams
962,sep-0920,business,"Dutch bank to lay off 2,850 staff"
963,sep-4665,sport,Edgy Agassi struggles past Dent
964,sep-3053,sport,Edwards tips Idowu for Euro gold
965,sep-4093,business,Electronics firms eye plasma deal
966,sep-1145,sport,England claim Dubai Sevens glory
967,sep-3077,sport,England's defensive crisis grows
968,sep-2562,business,Ericsson sees earnings improve
969,sep-4352,business,FAO warns on impact of subsidies
970,sep-2859,sport,Faultless Federer has no equal
971,sep-3900,sport,Fear will help France - Laporte
972,sep-3760,technology,Featured: 'No re-draft' for EU patent law
973,sep-2440,sport,Ferguson urges Henry punishment
974,sep-2872,sport,Ferrero eyes return to top form
975,sep-4414,business,Fiat chief takes steering wheel
976,sep-4877,technology,Football Manager scores big time
977,sep-3592,technology,Freeze on anti-spam campaign
978,sep-0022,business,French suitor holds LSE meeting
979,sep-0232,sport,Funding cut hits Wales Students
980,sep-1748,technology,Gadget show heralds MP3 Christmas
981,sep-4345,technology,Games firms 'face tough future'
982,sep-1443,business,Georgia plans hidden asset pardon
983,sep-4275,business,German jobless rate at new record
984,sep-0555,sport,Gerrard happy at Anfield
985,sep-4613,business,Go-ahead for Balkan oil pipeline
986,sep-2949,business,Golden rule 'intact' says ex-aide
987,sep-3287,sport,Henman overcomes rival Rusedski
988,sep-4860,sport,Henry tipped for Fifa award
989,sep-3046,sport,Highbury tunnel players in clear
990,sep-4890,sport,Holmes urged to compete at Worlds
991,sep-3678,technology,How to make a gigapixel picture
992,sep-3602,sport,IAAF awaits Greek pair's response
993,sep-4876,business,ID theft surge hits US consumers
994,sep-4207,business,India and Russia in energy talks
995,sep-1238,business,Indonesia 'declines debt freeze'
996,sep-4867,technology,Intel unveils laser breakthrough
997,sep-0823,business,Iran budget seeks state sell-offs
998,sep-0254,business,Iraq to invite phone licence bids
999,sep-3264,sport,Ireland 17-12 South Africa
1000,sep-2587,sport,Ireland 21-19 Argentina
1001,sep-4095,business,Jarvis sells Tube stake to Spain
1002,sep-1406,business,Krispy Kreme shares hit
1003,sep-2272,sport,Kuznetsova 'failed a drugs test'
1004,sep-0584,sport,Laporte tinkers with team
1005,sep-4404,sport,Lions blow to World Cup winners
1006,sep-1405,technology,Local net TV takes off in Austria
1007,sep-2520,technology,Losing yourself in online gaming
1008,sep-4936,technology,Media gadgets get moving
1009,sep-1696,technology,Mobile gaming takes off in India
1010,sep-3711,technology,More movies head to Sony's PSP
1011,sep-3745,technology,More women turn to net security
1012,sep-0082,sport,Mourinho expects fight to finish
1013,sep-3128,sport,Moya clinches Cup for Spain
1014,sep-4623,sport,Newcastle 27-27 Gloucester
1015,sep-0592,sport,O'Driscoll saves Irish blushes
1016,sep-1313,sport,O'Sullivan could run in Worlds
1017,sep-1672,sport,Old Firm pair handed suspensions
1018,sep-0863,technology,Online News leads interactive Bafta wins
1019,sep-1411,business,Palestinian economy in decline
1020,sep-3583,technology,Putting a face to 'Big Brother'
1021,sep-2426,business,Rich grab half Colombia poor fund
1022,sep-3558,business,Russia gets investment blessing
1023,sep-1539,business,Saab to build Cadillacs in Sweden
1024,sep-3347,technology,Security warning over 'FBI virus'
1025,sep-2082,sport,Spain coach faces racism inquiry
1026,sep-4027,technology,Spam e-mails tempt net shoppers
1027,sep-4329,technology,Sporting rivals go to extra time
1028,sep-4851,business,Standard Life cuts policy bonuses
1029,sep-1519,business,Stormy year for property insurers
1030,sep-1782,technology,Swap offer for pirated Windows XP
1031,sep-4130,sport,Sydney return for Henin-Hardenne
1032,sep-2601,business,Takeover rumour lifts Exel shares
1033,sep-0226,sport,Tanzania gets Fifa backing
1034,sep-2914,technology,Technology hijacked sports
1035,sep-0174,technology,Tough rules for ringtone sellers
1036,sep-4443,sport,Trial date is set for Balco case
1037,sep-0063,business,UK house prices dip in November
1038,sep-4940,business,UK interest rates held at 4.75%
1039,sep-2528,business,Venezuela identifies 'idle' farms
1040,sep-4107,sport,Verdict delay for Greek sprinters
1041,sep-2374,business,Verizon 'seals takeover of MCI'
1042,sep-3813,business,Vodafone appoints new Japan boss
1043,sep-2892,business,WMC says Xstrata bid is too low
1044,sep-0388,technology,Warnings on woeful wi-fi security
1045,sep-3414,business,Wembley firm won't make a profit
1046,sep-2293,business,Will Manchester United plc Short Squeeze Soon
1047,sep-1752,business,Worldcom director ends evidence
1048,sep-2040,sport,Yeading face Newcastle in FA Cup
1049,sep-0237,business,Yukos owner sues Russia for $28bn
1050,sep-2517,business,Yukos unit buyer faces loan claim
1051,oct-3861,sport,A need to limit foreign numbers
1052,oct-0443,technology,Apple iPod family expands market
1053,oct-0777,technology,Apple sues 'Tiger' file sharers
1054,oct-1914,technology,Apple sues to stop product leaks
1055,oct-2035,sport,Athens memories soar above lows
1056,oct-0709,technology,Ban hits Half-Life 2 pirates hard
1057,oct-1226,sport,Bath faced with Tindall ultimatum
1058,oct-0945,sport,Bellamy fined after row
1059,oct-1295,business,Brazil approves bankruptcy reform
1060,oct-4199,sport,Britain boosted by Holmes double
1061,oct-0924,technology,Britons fed up with net service
1062,oct-3880,business,Cactus diet deal for Phytopharm
1063,oct-3790,business,Call centre users 'lose patience'
1064,oct-3326,sport,Call for Kenteris to be cleared
1065,oct-1924,technology,Call for action on internet scam
1066,oct-3040,technology,Camera phones are 'must-haves'
1067,oct-1787,business,China's Shanda buys stake in Sina
1068,oct-2701,technology,Chip maker backs net phone calls
1069,oct-2317,sport,Cole refuses to blame van Persie
1070,oct-0300,sport,Collins appeals against drugs ban
1071,oct-4879,business,Consumers drive French economy
1072,oct-0163,sport,Crusaders 2-3 Ballymena United
1073,oct-4089,sport,Desailly backs Blues revenge trip
1074,oct-4812,technology,Digital guru floats sub-$100 PC
1075,oct-4850,technology,Doors open at biggest gadget fair
1076,oct-3470,sport,Double injury blow strikes Wales
1077,oct-4758,technology,EU software patent law faces axe
1078,oct-2145,business,Ebbers 'aware' of WorldCom fraud
1079,oct-3548,sport,England given tough Sevens draw
1080,oct-3256,technology,Europe backs digital TV lifestyle
1081,oct-4836,business,Executive trio leave Aer Lingus
1082,oct-2748,sport,FA Cup losing its sheen
1083,oct-0832,technology,Fast moving phone viruses appear
1084,oct-2828,business,Featured: 'Standoff' on Deutsche's LSE bid
1085,oct-0817,technology,Featured: 'Ultimate game' award for Doom 3
1086,oct-2348,sport,Federer joins all-time greats
1087,oct-1261,sport,Formula 1: US-Qatari investors 'to bid for sport'
1088,oct-0898,business,Fosters buys stake in winemaker
1089,oct-1441,business,French consumer spending rising
1090,oct-0064,technology,Games 'deserve a place in class'
1091,oct-2801,sport,Gatlin and Hayes win Owen awards
1092,oct-2209,business,German bidder in talks with LSE
1093,oct-2955,technology,Global blogger action day called
1094,oct-3459,sport,Greece defy the odds at Euro 2004
1095,oct-4140,sport,Greek pair set for hearing
1096,oct-4990,technology,Halo fans' hope for sequel
1097,oct-3207,business,Hariri killing hits Beirut shares
1098,oct-0844,sport,Hodgson relishes European clashes
1099,oct-2177,sport,Hong Kong in 2011 World Cup bid
1100,oct-3103,sport,IAAF will contest Greek decision
1101,oct-4815,technology,IBM puts cash behind Linux push
1102,oct-4038,business,IMF agrees fresh Turkey funding
1103,oct-1049,business,India and Iran in gas export deal
1104,oct-1011,business,India power shares jump on debut
1105,oct-0417,business,India's Deccan seals $1.8bn deal
1106,oct-3162,business,Indian oil firm eyes Yukos assets
1107,oct-0421,business,Israeli economy picking up pace
1108,oct-2333,business,Japan bank shares up on link talk
1109,oct-4803,business,Japanese mogul arrested for fraud
1110,oct-1193,sport,Kewell waits as injury drags on
1111,oct-4546,business,Khodorkovsky ally denies charges
1112,oct-0057,sport,Leeds v Saracens (Fri)
1113,oct-4981,sport,Liverpool pledge to keep Gerrard
1114,oct-4914,sport,Llewellyn plans Wales retirement
1115,oct-1753,business,Lloyd's of London head chides FSA
1116,oct-2102,sport,Mauresmo opens with victory in LA
1117,oct-2774,business,Metlife buys up Citigroup insurer
1118,oct-4605,technology,Microsoft seeking spyware trojan
1119,oct-3910,technology,Mobile audio enters new dimension
1120,oct-2454,technology,Mobile networks seek turbo boost
1121,oct-0059,technology,Movie body targets children's PCs
1122,oct-0992,technology,Napster offers rented music to go
1123,oct-2740,technology,New business technology trends
1124,oct-2886,sport,Nike defends under-fire football
1125,oct-4166,technology,Nintendo handheld given Euro date
1126,oct-2188,business,Nissan names successor to Ghosn
1127,oct-4084,technology,Nuclear body seeks new tech
1128,oct-2574,business,Oil prices reach three-month low
1129,oct-3663,technology,Open source leaders slam patents
1130,oct-2181,sport,Owen determined to stay in Madrid
1131,oct-0999,sport,Owen set for skipper role
1132,oct-2121,technology,Peer-to-peer nets 'here to stay'
1133,oct-2094,business,Pension hitch for long-living men
1134,oct-2301,sport,Radcliffe enjoys winning comeback
1135,oct-0815,technology,Reboot ordered for EU patent law
1136,oct-3222,sport,Relay squad thrilled with honours
1137,oct-4804,sport,Reyes tricked into Real admission
1138,oct-1215,technology,Rings of steel combat net attacks
1139,oct-2080,sport,Rivals back anti-racism campaign
1140,oct-0412,business,Ryanair in $4bn Boeing plane deal
1141,oct-3387,sport,SA supports Fifa control
1142,oct-3524,sport,Safin relieved at Aussie recovery
1143,oct-0580,sport,Scotland 18-10 Italy
1144,oct-0746,sport,Sculthorpe wants Lions captaincy
1145,oct-1921,business,Sluggish economy hits German jobs
1146,oct-0382,sport,Souness backs Smith for Scotland
1147,oct-1007,technology,Speak easy plan for media players
1148,oct-3749,business,Steady job growth continues in US
1149,oct-3029,technology,Sun offers processing by the hour
1150,oct-0721,technology,Supercomputer breaks speed record
1151,oct-0108,technology,TV future in the hands of viewers
1152,oct-3547,business,Tate & Lyle boss bags top award
1153,oct-0113,sport,Taylor poised for Scotland return
1154,oct-0512,sport,Tevez - an Argentine in Brazil
1155,oct-1276,technology,Tough rules for ringtone sellers
1156,oct-0911,business,Tsunami cost hits Jakarta shares
1157,oct-2527,business,Two Nigerian banks set to merge
1158,oct-0621,technology,UK net users leading TV downloads
1159,oct-1756,business,US bank 'loses' customer details
1160,oct-3563,technology,US duo in first spam conviction
1161,oct-3862,business,US firm pulls out of Iraq
1162,oct-2448,business,US gives foreign firms extra time
1163,oct-1751,business,US prepares for hybrid onslaught
1164,oct-1516,sport,Van Nistelrooy hungry for return
1165,oct-3160,business,WMC profits up amid bid criticism
1166,oct-0660,technology,Web logs aid disaster recovery
1167,oct-2835,sport,Wenger offers Mutu hope
1168,oct-4649,sport,What now for Kelly Holmes?
1169,oct-3920,sport,"Why technology in sport poses a threat to keeping the game fair, safe and affordable"
1170,oct-2293,sport,Williams battles to Aussie title
1171,oct-2189,business,WorldCom director admits lying
1172,oct-4749,business,Yukos bankruptcy 'not US matter'
1173,nov-3410,sport,All Black magic: New Zealand rugby
1174,nov-3432,sport,Anelka 'eyes Man City departure'
1175,nov-3526,technology,Apple Mac mini gets warm welcome
1176,nov-1412,technology,Apple laptop is 'greatest gadget'
1177,nov-2347,business,Asia quake increases poverty risk
1178,nov-2329,technology,Ask Jeeves joins web log market
1179,nov-0186,business,Australia rates at four year high
1180,nov-0386,business,BMW reveals new models pipeline
1181,nov-1815,business,BMW to recall faulty diesel cars
1182,nov-3071,business,Ban on forced retirement under 65
1183,nov-3512,business,Bank opts to leave rates on hold
1184,nov-3037,business,Bank voted 8-1 for no rate change
1185,nov-4414,business,Barclays profits hit record level
1186,nov-4953,sport,Beckham rules out management move
1187,nov-2298,business,Boeing secures giant Japan order
1188,nov-3205,sport,Bookies pay out on Spurs 'goal'
1189,nov-0449,business,Booming markets shed few tears
1190,nov-4384,sport,Borders 19-20 Ulster
1191,nov-4904,sport,Bortolami predicts dour contest
1192,nov-3590,sport,Brentford v Southampton
1193,nov-3584,sport,Bridge could miss rest of season
1194,nov-4254,technology,Britons growing 'digitally obese'
1195,nov-2334,technology,Broadband fuels online change
1196,nov-2909,business,Budget Aston takes on Porsche
1197,nov-3579,sport,Campbell rescues Arsenal
1198,nov-2737,business,Car giant hit by Mercedes slump
1199,nov-4176,sport,Celtic unhappy over Bulgaria date
1200,nov-1674,sport,Collins to compete in Birmingham
1201,nov-1801,technology,Computer grid to help the world
1202,nov-4606,sport,Connors' rallying cry for British tennis
1203,nov-2647,technology,Consumers 'snub portable video'
1204,nov-3091,business,Court rejects $280bn tobacco case
1205,nov-2546,business,Criminal probe on Citigroup deals
1206,nov-4461,sport,Dawson joins England injury list
1207,nov-2714,sport,Desailly backs Blues revenge trip
1208,nov-2130,technology,Digital UK driven by net and TV
1209,nov-3500,business,Disney settles disclosure charges
1210,nov-1451,sport,Downing injury mars Uefa victory
1211,nov-0372,sport,Duff ruled out of Barcelona clash
1212,nov-4242,business,ECB holds rates amid growth fears
1213,nov-2953,technology,EU software patent law delayed
1214,nov-1329,business,Fiat mulls Ferrari market listing
1215,nov-2527,technology,Finding new homes for old phones
1216,nov-3879,technology,Firefox browser takes on Microsoft
1217,nov-4060,technology,France starts digital terrestrial
1218,nov-3626,business,G7 backs Africa debt relief plan
1219,nov-3702,sport,GB select Holmes for double bid
1220,nov-0130,business,"GM, Ford cut output as sales fall"
1221,nov-4260,sport,Gallas sees two-horse race
1222,nov-3907,technology,Games enter the classroom
1223,nov-0746,sport,Gardener battles to narrow win
1224,nov-0232,business,Gold falls on IMF sale concerns
1225,nov-1428,business,Green reports shun supply chain
1226,nov-1085,technology,Half-Life 2 sweeps Bafta awards
1227,nov-1407,sport,Hearts 2-1 Livingston
1228,nov-3342,sport,Hingis to make unexpected return
1229,nov-4180,sport,Hitzlsperger waiting on O'Leary
1230,nov-1466,technology,How to make a greener computer
1231,nov-4049,sport,IAAF to rule on Greek sprint pair
1232,nov-4897,business,IMF 'cuts' German growth estimate
1233,nov-0748,business,Indonesians face fuel price rise
1234,nov-1277,technology,Internet boom for gift shopping
1235,nov-0580,sport,Iranian misses Israel match
1236,nov-3296,business,Japanese banking battle at an end
1237,nov-4356,sport,Johnson announces June retirement
1238,nov-3617,sport,Johnson edges out rival Sotherton
1239,nov-1260,sport,Jol joy at 'professional' Cup win
1240,nov-0628,sport,Jones files Conte lawsuit
1241,nov-0654,technology,Junk e-mails on relentless rise
1242,nov-0518,business,Karachi stocks hit historic high
1243,nov-2968,technology,Kenyan school turns to handhelds
1244,nov-3867,technology,Looks and music to drive mobiles
1245,nov-0420,business,McDonald's to sponsor MTV show
1246,nov-4250,sport,Mexicans tracking unhappy Juninho
1247,nov-4495,technology,Microsoft gets the blogging bug
1248,nov-2769,business,Millions go missing at China bank
1249,nov-1623,technology,Mobile music challenges 'iPod age'
1250,nov-4572,sport,Moody joins up with England
1251,nov-1118,sport,Mourinho defiant on Chelsea form
1252,nov-4319,technology,Movie body hits peer-to-peer nets
1253,nov-0662,sport,Moya emotional at Davis Cup win
1254,nov-0319,sport,Newry to fight cup exit in courts
1255,nov-1730,technology,Norway upholds 'Napster' ruling
1256,nov-4517,technology,Online News web search aids odd queries
1257,nov-1386,technology,PC photo printers challenge pros
1258,nov-3935,sport,Palace threat over Cantona masks
1259,nov-0317,business,Parmalat bank barred from suing
1260,nov-0906,sport,Pennant guilty of wasting talent
1261,nov-2832,sport,Player burn-out worries Robinson
1262,nov-1255,business,Qwest may spark MCI bidding war
1263,nov-4235,business,Rank 'set to sell off film unit'
1264,nov-2326,sport,Reaction from Spanish press
1265,nov-1637,business,Retail sales show festive fervour
1266,nov-0761,sport,Roddick to face Saulnier in final
1267,nov-4428,sport,Rush future at Chester uncertain
1268,nov-4174,business,Russian oil merger excludes Yukos
1269,nov-2399,business,S Korean credit card firm rescued
1270,nov-2282,sport,Scrum-half Williams rejoins Bath
1271,nov-1288,technology,Smartphones suffer Skulls attack
1272,nov-3650,technology,Software watching while you work
1273,nov-0435,sport,Sports Direct investors veto £11m payout to Ashley's brother
1274,nov-1149,business,Survey confirms property slowdown
1275,nov-0147,sport,Tartan Army given safety pledge
1276,nov-1264,sport,Teenager Tait picked for England
1277,nov-2018,technology,Text message record smashed again
1278,nov-2115,sport,Thomas out of Six Nations
1279,nov-4659,business,Tobacco giants hail court ruling
1280,nov-2397,technology,Toxic web links help virus spread
1281,nov-1341,business,Tsunami slows Sri Lanka's growth
1282,nov-3574,business,UK young top Euro earnings league
1283,nov-2226,technology,US duo in first spam conviction
1284,nov-0560,business,US regulator to rule on pain drug
1285,nov-4374,technology,US state acts to stop 'spammers'
1286,nov-0575,business,US to probe airline travel chaos
1287,nov-1388,sport,Wales hails new superstar
1288,nov-3587,business,Wall Street cheers Bush victory
1289,nov-0584,technology,What price for 'trusted PC security'?
1290,nov-4426,sport,Wilkinson to lead England
1291,nov-2469,technology,Windows worm travels with Tetris
1292,nov-1794,business,Winter freeze keeps oil above $50
1293,nov-1348,business,Worldcom ex-boss launches defence
1294,dec-0244,sport,2004 - A year to remember
1295,dec-0895,business,Absa and Barclays talks continue
1296,dec-4490,technology,Ask Jeeves joins web log market
1297,dec-0891,business,Ask Jeeves tips online ad revival
1298,dec-0672,business,BMW cash to fuel Mini production
1299,dec-3487,technology,Bad e-mail habits sustains spam
1300,dec-0478,business,Bad weather hits Nestle sales
1301,dec-2633,sport,Barbarians 19-47 New Zealand
1302,dec-4269,sport,Big guns ease through in San Jose
1303,dec-1656,sport,Blues slam Blackburn over Savage
1304,dec-3628,business,Borussia Dortmund near bust
1305,dec-2267,business,Brazil buy boosts Belgium's Inbev
1306,dec-4194,technology,Broadband soars in 2004
1307,dec-2360,technology,China 'ripe' for media explosion
1308,dec-2956,business,China continues breakneck growth
1309,dec-4469,business,Chinese wine tempts Italy's Illva
1310,dec-2115,business,Consumer spending lifts US growth
1311,dec-0625,business,Could Yukos be a blessing in disguise?
1312,dec-2771,sport,Cup holders Man Utd visit Everton
1313,dec-0788,sport,D'Arcy injury adds to Ireland woe
1314,dec-1911,sport,Dallaglio eyeing Lions tour place
1315,dec-3413,business,Delta cuts fares in survival plan
1316,dec-0038,business,Dollar gains on Greenspan speech
1317,dec-0035,technology,Dozens held over ID fraud site
1318,dec-4444,business,Economy 'strong' in election year
1319,dec-4307,sport,Edu describes tunnel fracas
1320,dec-4450,sport,European medal chances improve
1321,dec-3044,sport,Federer breezes into semi-finals
1322,dec-3401,sport,Federer claims Dubai crown
1323,dec-1775,sport,Ferdinand casts doubt over Glazer
1324,dec-2589,technology,File-swappers ready new network
1325,dec-3264,business,France Telecom gets Orange boost
1326,dec-0784,technology,Game firm holds 'cast' auditions
1327,dec-2635,technology,Games maker fights for survival
1328,dec-3589,technology,Games win for Blu-ray DVD format
1329,dec-3518,technology,Gizmondo gadget hits the shelves
1330,dec-0473,business,Glaxo aims high after profit fall
1331,dec-2110,technology,Global digital divide 'narrowing'
1332,dec-2790,business,Google shares fall as staff sell
1333,dec-0180,sport,Hamm bows out for US
1334,dec-3784,sport,Harinordoquy suffers France axe
1335,dec-3423,sport,Hewitt overcomes wobble in Sydney
1336,dec-4596,technology,Hollywood campaign hits websites
1337,dec-1585,business,House prices rebound says Halifax
1338,dec-2351,business,India calls for fair trade rules
1339,dec-2624,business,India opens skies to competition
1340,dec-1865,business,Industrial output falls in Japan
1341,dec-0232,business,Irish markets reach all-time high
1342,dec-4377,business,Japan narrowly escapes recession
1343,dec-4926,business,Japan turns to beer alternatives
1344,dec-1263,technology,Joke e-mail virus tricks users
1345,dec-1718,sport,Jones files lawsuit against Conte
1346,dec-2008,sport,Jones happy with Henson heroics
1347,dec-4999,sport,Jones medals 'must go if guilty'
1348,dec-3411,sport,Lewsey puzzle over disallowed try
1349,dec-2288,technology,Lifestyle 'governs mobile choice'
1350,dec-1460,sport,Linesman defends disallowed goal
1351,dec-3392,sport,London Irish 19-33 Wasps
1352,dec-0393,sport,Melzer shocks Agassi
1353,dec-1629,technology,Microsoft plans 'safer ID' system
1354,dec-1156,technology,Millions to miss out on the net
1355,dec-0557,technology,Mobile games come of age
1356,dec-4844,technology,Mobile gig aims to rock 3G
1357,dec-3260,sport,Moya fights back for Indian title
1358,dec-1963,technology,Multi-purpose TV aids India
1359,dec-3608,sport,Munster Cup tie switched to Spain
1360,dec-4161,business,Nortel in $300m profit revision
1361,dec-0910,sport,Officials respond in court row
1362,dec-4820,business,Oil rebounds from weather effect
1363,dec-2402,sport,Parry firm over Gerrard
1364,dec-1135,sport,Parry puts Gerrard 'above money'
1365,dec-0909,technology,Piero gives rugby perspective
1366,dec-4678,technology,Players sought for $1m prize
1367,dec-0712,sport,QPR keeper Day heads for Preston
1368,dec-0481,business,Renault boss hails 'great year'
1369,dec-3993,technology,Report: Benitez delight after crucial win
1370,dec-3175,technology,Rings of steel combat net attacks
1371,dec-3052,business,Saudi NCCI's shares soar
1372,dec-3186,technology,Savvy searchers fail to spot ads
1373,dec-0204,sport,Scots suffer another injury blow
1374,dec-4675,technology,Search wars hit desktop PCs
1375,dec-2813,technology,Security warning over 'FBI virus'
1376,dec-3030,technology,Slow start to speedy net services
1377,dec-3403,technology,Sony PSP handheld console hits US
1378,dec-2445,technology,Sony PSP tipped as a 'must-have'
1379,dec-4353,sport,Stevens named in England line-up
1380,dec-2117,technology,T-Mobile bets on 'pocket office'
1381,dec-3966,business,Takeover offer for Sunderland FC
1382,dec-1690,technology,The future in your pocket
1383,dec-3207,sport,The gloves are off
1384,dec-2963,sport,Tigers wary of Farrell 'gamble'
1385,dec-2023,business,Troubled Marsh under SEC scrutiny
1386,dec-2397,technology,UK gets official virus alert site
1387,dec-3903,technology,US blogger fired by her airline
1388,dec-3692,business,US company admits Benin bribery
1389,dec-0367,business,US seeks new $280bn smoker ruling
1390,dec-3169,technology,US woman sues over cartridges
1391,dec-0271,sport,Uefa approves fake grass
1392,dec-4210,sport,Unclear future for striker Baros
1393,dec-0983,business,Venezuela reviews foreign deals
1394,dec-3570,sport,Vickery out of Six Nations
1395,dec-2331,sport,Wales make two changes for France
1396,dec-3694,technology,Warning over tsunami aid website
1397,dec-1576,business,Weak dollar hits Online News
1398,dec-4918,sport,Wenger dejected as Arsenal slump
1399,dec-2759,technology,What high-definition will do to DVDs
1400,dec-4347,technology,What's next for next-gen consoles?
1401,dec-3179,business,Why few targets are better than many
1402,dec-1456,technology,Wi-fi web reaches farmers in Peru
1403,dec-2238,sport,Woodward eyes Brennan for Lions
1404,dec-2334,business,WorldCom trial starts in New York
1405,dec-2095,business,Yukos accused of lying to court
1406,dec-1351,business,Yukos drops banks from court bid
1407,dec-0068,sport,Zambia confident and cautious
