,article_id,category,title
475,may-2027,business,Apple Inc. Phone Pricing Likely To Trend Lower
476,may-2024,business,Argentina closes $102.6bn debt swap
477,may-2738,business,AstraZeneca hit by drug failure
478,may-4424,sport,Balco case trial date pushed back
479,may-2659,business,Battered dollar hits another low
480,may-4512,sport,Beckham hints at Man Utd return
481,may-0131,sport,Benitez joy as Reds take control
482,may-2874,technology,Blind student 'hears in colour'
483,may-2905,technology,Blogger grounded by her airline
484,may-1663,business,Brazil jobless rate hits new low
485,may-1702,technology,Broadband set to revolutionise TV
486,may-4777,technology,Bush website blocked outside US
487,may-2166,business,Business confidence dips in Japan
488,may-1662,business,Businesses fail to plan for HIV
489,may-1837,sport,Campese berates whingeing England
490,may-1887,sport,Cech sets clean-sheet benchmark
491,may-3273,technology,China 'blocks Google news site'
492,may-2294,business,China continues rapid growth
493,may-3257,business,Circuit City gets takeover offer
494,may-2723,sport,Claxton hunting first major medal
495,may-1549,technology,Consumer concern over RFID tags
496,may-0149,business,Continental 'may run out of cash'
497,may-2122,business,Deadline nears for Fiat-GM deal
498,may-4336,business,Deutsche Boerse set to 'woo' LSE
499,may-0706,technology,Domain system scam fear
500,may-0573,technology,Doors open at biggest gadget fair
501,may-2915,sport,Dunne keen to commit to Man City
502,may-1785,business,EMI shares hit by profit warning
503,may-1306,business,EU to probe Alitalia 'state aid'
504,may-2222,sport,England 'to launch ref protest'
505,may-1674,sport,Faye plans to stay at Portsmouth
506,may-3633,business,Featured: 'Strong dollar' call halts slide
507,may-3723,sport,Ferguson hails Man Utd's resolve
508,may-2499,sport,Fuming Robinson blasts officials
509,may-2400,business,Further rise in UK jobless total
510,may-2476,technology,Gadget growth fuels eco concerns
511,may-2112,technology,Gadget show heralds MP3 season
512,may-2581,technology,Games win for Blu-ray DVD format
513,may-2727,business,German business confidence slides
514,may-0713,sport,Gerrard future not decided by Cardiff loss
515,may-4324,technology,Halo 2 sells five million copies
516,may-4280,sport,Henin-Hardenne beaten on comeback
517,may-0143,sport,Hewitt falls to Dent in Adelaide
518,may-2440,technology,How to smash a home computer
519,may-1036,sport,Ireland call up uncapped Campbell
520,may-0966,business,Israel looks to US for bank chief
521,may-4655,sport,Keane defiant over Vieira bust-up
522,may-2796,sport,Kenya lift Chepkemei's suspension
523,may-0305,business,Kraft cuts snack ads for children
524,may-2491,business,Lesotho textile workers lose jobs
525,may-2781,sport,Lomu relishing return to action
526,may-1795,business,Lufthansa may sue over Bush visit
527,may-0332,business,MCI shares climb on takeover bid
528,may-4014,business,MG Rover China tie-up 'delayed'
529,may-4886,business,Making your office work for you
530,may-4104,sport,McIlroy continues winning streak
531,may-1112,technology,Mobile TV tipped as one to watch
532,may-0180,business,Monsanto fined $1.5m for bribery
533,may-1740,technology,Moving mobile improves golf swing
534,may-4133,sport,Nadal puts Spain 2-0 up
535,may-0916,business,Nasdaq planning $100m-share sale
536,may-3761,technology,New Year's texting breaks record
537,may-4517,technology,New consoles promise big problems
538,may-1326,technology,Nintendo DS makes its Euro debut
539,may-0373,sport,O'Connor aims to grab opportunity
540,may-4484,sport,O'Leary agrees new Villa contract
541,may-4229,sport,O'Sullivan keeps his powder dry
542,may-4474,technology,Online commons to spark debate
543,may-1687,technology,Online games play with politics
544,may-1905,business,Parmalat founder offers apology
545,may-2611,business,Parmalat to return to stockmarket
546,may-4895,technology,Peer-to-peer nets 'here to stay'
547,may-0016,business,Pernod takeover talk lifts Domecq
548,may-1238,business,Profits jump at China's top bank
549,may-1947,sport,Prop Jones ready for hard graft
550,may-2512,business,Qatar and Shell in $6bn gas deal
551,may-1598,business,Quake's economic costs emerging
552,may-4585,sport,Real in talks over Gravesen move
553,may-4874,business,Rescue hope for Borussia Dortmund
554,may-0488,sport,Robben and Cole earn Chelsea win
555,may-0292,technology,Robotic pods take on car design
556,may-3235,sport,Roddick in talks over new coach
557,may-1464,business,SEC to rethink post-Enron rules
558,may-2443,technology,Santy worm makes unwelcome visit
559,may-2260,technology,Seamen sail into biometric future
560,may-3908,sport,Serena becomes world number two
561,may-2514,sport,Smith aims to bring back respect
562,may-0985,business,Soaring oil 'hits world economy'
563,may-3855,technology,Software watching while you work
564,may-0057,technology,Sony PSP console hits US in March
565,may-0549,sport,TV calls after Carroll error
566,may-0738,technology,TV's future down the phone line
567,may-1288,business,The 'ticking budget' facing the US
568,may-2467,business,Train strike grips Buenos Aires
569,may-2263,technology,UK broadband gets speed injection
570,may-0648,business,US adds more jobs than expected
571,may-3222,business,US economy shows solid GDP growth
572,may-1355,business,US economy still growing says Fed
573,may-3184,business,US in EU tariff chaos trade row
574,may-2365,business,US retail sales surge in December
575,may-0720,business,US trade gap hits record in 2004
576,may-3287,business,Ukraine revisits state sell-offs
577,may-2299,sport,Underdogs have more fun
578,may-0748,business,VW considers opening Indian plant
579,may-4097,business,Wal-Mart to pay $14m in gun suit
580,may-2131,sport,Wasps 31-37 Leicester
581,may-3461,technology,What high-definition will do to DVDs
582,may-4326,technology,Why Cell will get the hard sell
583,may-2814,sport,Wilkinson fit to face Edinburgh
584,may-2271,sport,Wilkinson return 'unlikely'
585,may-3619,technology,Yahoo celebrates a decade online
586,may-0996,technology,Yahoo moves into desktop search
587,jun-1972,technology,2D Metal Slug offers retro fun
588,jun-1987,technology,Anti-spam laws bite spammer hard
589,jun-0716,technology,Apple laptop is 'greatest gadget'
590,jun-2935,technology,Apple makes blogs reveal sources
591,jun-4840,technology,Apple unveils low-cost 'Mac mini'
592,jun-4479,business,Arsenal 'may seek full share listing'
593,jun-1568,business,BA to suspend two Saudi services
594,jun-1579,business,BMW drives record sales in Asia
595,jun-3219,business,BT offers equal access to rivals
596,jun-1778,sport,Barwick calls for Highbury calm
597,jun-1644,sport,Barwick installed as new FA boss
598,jun-2609,technology,Be careful how you code
599,jun-1346,business,Beer giant swallows Russian firm
600,jun-3633,technology,Blinx sequel purrs nicely
601,jun-3298,business,Bombardier chief to leave company
602,jun-3624,technology,Bond game fails to shake or stir
603,jun-0532,business,Britannia members' £42m windfall
604,jun-2071,technology,California sets fines for spyware
605,jun-1491,business,Call to save manufacturing jobs
606,jun-1294,sport,Can Smith work Scottish wonders?
607,jun-1801,technology,Cebit fever takes over Hanover
608,jun-4596,sport,Chelsea clinch cup in extra-time
609,jun-4483,technology,China 'to overtake US net use'
610,jun-0384,business,China bans new tobacco factories
611,jun-3025,sport,Davenport dismantles young rival
612,jun-3207,business,Disaster claims 'less than $10bn'
613,jun-3422,business,Dollar drops on reserves concerns
614,jun-3285,business,EU 'too slow' on economic reforms
615,jun-1131,sport,English clubs make Euro history
616,jun-4266,business,Ex-Boeing director gets jail term
617,jun-4362,sport,FA decides not to punish Mourinho
618,jun-0537,technology,Fast lifts rise into record books
619,jun-1448,technology,Featured: 'Blog' picked as word of the year
620,jun-4007,technology,Featured: 'Brainwave' cap controls computer
621,jun-3887,technology,Featured: 'Podcasters' look to net money
622,jun-3406,business,Fresh hope after Argentine crisis
623,jun-2920,technology,Gadget market 'to grow in 2005'
624,jun-2699,technology,Gates opens biggest gadget fair
625,jun-0332,sport,Gebrselassie in London triple bid
626,jun-4500,sport,Gerrard plays down European hopes
627,jun-1482,business,Giant waves damage S Asia economy
628,jun-0787,business,Giving financial gifts to children
629,jun-2022,business,Golden rule boost for Chancellor
630,jun-3687,sport,Henman hopes ended in Dubai
631,jun-3700,technology,Hitachi unveils 'fastest robot'
632,jun-3528,technology,Hotspot users gain free net calls
633,jun-2557,business,"How Manchester United, Knicks Wins Correlate With Stock Gains"
634,jun-2381,business,Hyundai to build new India plant
635,jun-1633,business,Industrial revival hope for Japan
636,jun-4342,business,Insurance bosses plead guilty
637,jun-4535,business,Iraq and Afghanistan in WTO talks
638,jun-1155,sport,Ireland surge past Scots
639,jun-0553,sport,Italy 17-28 Ireland
640,jun-1387,business,JP Morgan admits US slavery links
641,jun-2401,sport,Keegan hails comeback king Fowler
642,jun-4329,technology,Kenyan school turns to handhelds
643,jun-1532,technology,Long life promised for laptop PCs
644,jun-1434,business,M&S cuts prices by average of 24%
645,jun-2521,business,MCI shareholder sues to stop bid
646,jun-2097,business,Market unfazed by Aurora setback
647,jun-2226,technology,Microsoft takes on desktop search
648,jun-4453,business,Millions 'to lose textile jobs'
649,jun-4509,technology,Mobile networks seek turbo boost
650,jun-2467,technology,Mobiles 'not media players yet'
651,jun-1038,technology,Mobiles double up as bus tickets
652,jun-2420,technology,Mobiles rack up 20 years of use
653,jun-4994,sport,Mourinho takes swipe at Arsenal
654,jun-3434,sport,Mourinho to escape FA charge
655,jun-4410,technology,Net regulation 'still possible'
656,jun-0925,technology,New delay hits EU software laws
657,jun-1788,business,Newest EU members underpin growth
658,jun-0749,sport,No lack of Christmas spirit
659,jun-4657,sport,O'Driscoll/Gregan lead Aid stars
660,jun-2787,business,Optimism remains over UK housing
661,jun-2319,business,Orange colour clash set for court
662,jun-1141,sport,Owen delighted with Real display
663,jun-4805,technology,Pandas benefit from wireless net
664,jun-0101,technology,Parents face video game lessons
665,jun-4636,sport,Petit career ended by knee injury
666,jun-1885,sport,Plymouth 3-0 Sheff Utd
667,jun-1112,sport,Preview: Ireland v England (Sun)
668,jun-4470,sport,Prinz beats Hamm to Fifa trophy
669,jun-3966,business,Profits slide at India's Dr Reddy
670,jun-1668,sport,Prutton poised for lengthy FA ban
671,jun-1940,technology,Rivals of the £400 Apple...
672,jun-0693,sport,Robinson answers critics
673,jun-0583,sport,Rochus shocks Coria in Auckland
674,jun-4042,business,"Rover deal 'may cost 2,000 jobs'"
675,jun-1150,sport,Running around the Olympics
676,jun-0829,business,SA unveils 'more for all' budget
677,jun-4361,business,SBC plans post-takeover job cuts
678,jun-2660,business,Safety alert as GM recalls cars
679,jun-3293,business,Saudi ministry to employ women
680,jun-4523,technology,Savvy searchers fail to spot ads
681,jun-2536,business,Shares hit by MS drug suspension
682,jun-0684,business,Slowdown hits US factory growth
683,jun-3126,technology,Spam e-mails tempt net shoppers
684,jun-1396,technology,Text messages aid disaster recovery
685,jun-3380,sport,The wonder of Ronaldinho
686,jun-3599,technology,The year search became personal
687,jun-0780,sport,Tomlinson stays focused on Europe
688,jun-0505,business,US bank boss hails 'genius' Smith
689,jun-2320,business,US consumer confidence up
690,jun-3360,business,US trade deficit widens sharply
691,jun-1094,sport,Uefa threat over foreign quotas
692,jun-2505,business,Ukraine steel sell-off 'illegal'
693,jun-2405,business,Ukraine trims privatisation check
694,jun-4106,sport,Venus stunned by Farina Elia
695,jun-0039,sport,Video technology will not make football a mistake-free sport
696,jun-2519,technology,Warning over Windows Word files
697,jun-1446,business,Weak dollar trims Cadbury profits
698,jun-1293,technology,Web helps collect aid donations
699,jun-4259,sport,Wenger handed summer war chest
700,jun-4520,technology,When technology gets personal
701,jul-1745,technology,A decade of good website design
702,jul-0465,sport,Agassi fear for Melbourne
703,jul-4512,business,Ailing EuroDisney vows turnaround
704,jul-2758,sport,Ajax refuse to rule out Jol move
705,jul-4068,sport,Anelka apologises for criticism
706,jul-1257,technology,Apple attacked over sources row
707,jul-2965,technology,Apple iPod family expands market
708,jul-2977,technology,Argonaut founder rebuilds empire
709,jul-0794,sport,Arsenal 1-1 Sheff Utd
710,jul-0495,business,Asia shares defy post-quake gloom
711,jul-2215,business,Aviation firms eye booming India
712,jul-4187,technology,BT program to beat dialler scams
713,jul-3607,business,Bat spit drug firm goes to market
714,jul-3406,sport,Bees handed potential Man Utd tie
715,jul-4480,sport,Blackburn v Burnley
716,jul-4575,business,Boeing unveils new 777 aircraft
717,jul-2829,sport,Breaking news: US company admits Benin bribery
718,jul-4356,technology,Broadband in the UK growing fast
719,jul-3487,sport,Bryan twins keep US hopes alive
720,jul-3941,business,Building giant in asbestos payout
721,jul-4527,technology,California sets fines for spyware
722,jul-3516,business,Call to overhaul UK state pension
723,jul-0165,sport,Campbell to be Lions consultant
724,jul-2340,sport,Cantona issues Man Utd job hint
725,jul-4614,business,Chinese exports rise 25% in 2004
726,jul-2009,sport,Clijsters could play Aussie Open
727,jul-2742,sport,Corry backs skipper Robinson
728,jul-3010,technology,DVD copy protection strengthened
729,jul-4101,sport,Dallaglio his own man to the end
730,jul-2708,sport,Dawson wins England squad recall
731,jul-4268,sport,Dementieva prevails in Hong Kong
732,jul-4019,technology,Disney backs Sony DVD technology
733,jul-1748,sport,Dominici backs lacklustre France
734,jul-1249,technology,Dublin hi-tech labs to shut down
735,jul-4170,business,Ebbers denies WorldCom fraud
736,jul-2162,sport,England coach faces rap after row
737,jul-0339,business,European losses hit GM's profits
738,jul-2286,sport,Fifa agrees goal-line technology
739,jul-2988,technology,Freeze on anti-spam campaign
740,jul-4021,business,French boss to leave EADS
741,jul-4373,business,German economy rebounds
742,jul-4895,business,Glazer makes new Man Utd approach
743,jul-4326,technology,Google to scan famous libraries
744,jul-0662,sport,Greek sprinters 'won't run again'
745,jul-2558,sport,Greek sprinters suspended by IAAF
746,jul-3455,sport,Gunners clock up winning record
747,jul-4969,technology,Halo 2 heralds traffic explosion
748,jul-3422,sport,Henson stakes early Lions claim
749,jul-1711,sport,Hewitt fights back to reach final
750,jul-2063,sport,Holmes is hit by hamstring injury
751,jul-2960,technology,IBM frees 500 software patents
752,jul-4915,business,India's Reliance family feud heats up
753,jul-4812,business,India's rupee hits five-year high
754,jul-3520,technology,Ink helps drive democracy in Asia
755,jul-0643,sport,Irish finish with home game
756,jul-3273,business,J&J agrees $25bn Guidant deal
757,jul-3870,sport,Johansson takes Adelaide victory
758,jul-0803,sport,Jones doping probe begins
759,jul-4157,sport,Kenteris denies faking road crash
760,jul-0297,business,Khodorkovsky quits Yukos shares
761,jul-4908,technology,Latest Opera browser gets vocal
762,jul-1013,sport,Legendary Dutch boss Michels dies
763,jul-4496,sport,Lions blow to World Cup stars
764,jul-3168,sport,Liverpool revel in night of glory
765,jul-4242,business,Man Utd to open books to Glazer
766,jul-2527,sport,Man Utd urged to seal Giggs deal
767,jul-1760,sport,Melzer shocks Agassi in San Jose
768,jul-4400,technology,Microsoft debuts security tools
769,jul-4827,technology,Millions buy MP3 players in US
770,jul-4341,technology,Mobile multimedia slow to catch on
771,jul-3525,technology,Mobiles get set for visual radio
772,jul-2544,technology,Mobiles rack up 20 years of use
773,jul-0637,sport,Molby says Gravesen is Real deal
774,jul-4798,technology,More power to the people says HP
775,jul-2909,technology,Musicians 'upbeat' about the net
776,jul-2815,business,News Corp eyes video games market
777,jul-4628,technology,No half measures with Half-Life 2
778,jul-1361,sport,Parmar ruled out of Davis Cup tie
779,jul-0597,sport,Philippoussis doubt over Open bid
780,jul-2241,technology,Pompeii gets digital make-over
781,jul-1728,business,Q&A: Malcolm Glazer and Man Utd
782,jul-1219,sport,Radcliffe eyes hard line on drugs
783,jul-4829,sport,Real will finish abandoned match
784,jul-1320,sport,Ref stands by Scotland decisions
785,jul-2463,sport,Robinson wants dual code success
786,jul-3438,sport,Roche 'turns down Federer offer'
787,jul-4719,sport,Roddick splits from coach Gilbert
788,jul-3289,sport,Ronaldinho denies Blues interest
789,jul-2439,business,S Korea spending boost to economy
790,jul-3943,business,S Korean consumers spending again
791,jul-3331,business,Saudi investor picks up the Savoy
792,jul-3957,sport,Sella wants Michalak recall
793,jul-0733,business,Share boost for feud-hit Reliance
794,jul-0168,business,Shares rise on new Man Utd offer
795,jul-2667,technology,Sony PSP tipped as a 'must-have'
796,jul-4244,sport,Souness eyes summer move for Owen
797,jul-0334,technology,Souped-up wi-fi is on the horizon
798,jul-0645,business,South African car demand surges
799,jul-3380,sport,Stam spices up Man Utd encounter
800,jul-0019,sport,Tapping-up row is so much hot air
801,jul-4790,technology,Technology gets the creative bug
802,jul-4384,technology,Technology in rugby: GPS systems continue to grow in importance
803,jul-3522,sport,Tindall aiming to earn Lions spot
804,jul-1717,sport,Tindall wants second opinion
805,jul-1112,business,Tsunami 'to hit Sri Lanka banks'
806,jul-0202,business,UK economy facing 'major risks'
807,jul-1885,business,US Ahold suppliers face charges
808,jul-3830,business,US data sparks inflation worries
809,jul-0931,business,US interest rate rise expected
810,jul-1059,technology,US peer-to-peer pirates convicted
811,jul-3879,sport,"Umaga ready for ""fearsome"" Lions"
812,jul-4233,technology,Virus poses as Christmas e-mail
813,jul-0417,business,Wal-Mart fights back at accusers
814,jul-3332,sport,Wales coach elated with win
815,jul-0589,business,Warning over US pensions deficit
816,jul-4193,technology,Web photo storage market hots up
817,jul-0503,technology,Web radio takes Spanish rap global
818,jul-1350,sport,Wenger keeping faith with Almunia
819,jul-1729,sport,Wenger steps up row
820,jul-4500,sport,What now for British tennis?
821,jul-3874,sport,White admits to Balco drugs link
822,jul-2168,technology,World tour for top video gamers
823,aug-3515,business,$1m payoff for former Shell boss
824,aug-1123,technology,Anti-tremor mouse stops PC shakes
825,aug-4475,technology,Apple unveils low-cost 'Mac mini'
826,aug-3384,business,"Argentina, Venezuela in oil deal"
827,aug-4019,sport,Argentine great Caniggia retires
828,aug-0806,business,Banker loses sexism claim
829,aug-4964,business,Beijingers fume over parking fees
830,aug-4265,sport,Bell set for England debut
831,aug-3926,sport,Benitez issues warning to Gerrard
832,aug-4614,sport,Blackburn 0-1 Chelsea
833,aug-2567,business,Brazil plays down Varig rescue
834,aug-4701,technology,Britons fed up with net service
835,aug-0893,technology,Broadband takes on TV viewing
836,aug-4668,business,Brussels raps mobile call charges
837,aug-1637,sport,Butler strikes gold in Spain
838,aug-0324,sport,Chelsea denied by James heroics
839,aug-0908,business,China had role in Yukos split-up
840,aug-1443,sport,Clijsters hope on Aussie Open
841,aug-3079,sport,Costin aims for comeback in 2006
842,aug-0896,business,DaimlerChrysler's 2004 sales rise
843,aug-4896,sport,Dal Maso in to replace Bergamasco
844,aug-3579,sport,Davenport hits out at Wimbledon
845,aug-4658,sport,Dein concerned by Chelsea stance
846,aug-2737,business,Deutsche Boerse boosts dividend
847,aug-1784,business,EU ministers to mull jet fuel tax
848,aug-2063,business,Euronext joins bid battle for LSE
849,aug-1532,technology,Featured: 'No re-draft' for EU patent law
850,aug-0644,technology,Featured: 'Ultimate game' award for Doom 3
851,aug-3247,business,Fed chief warning on US deficit
852,aug-2464,sport,Ferguson rues failure to cut gap
853,aug-2142,business,GM pays $2bn to evade Fiat buyout
854,aug-1157,business,GSK aims to stop Aids profiteers
855,aug-2119,technology,GTA sequel is criminally good
856,aug-3859,technology,"Gamer buys $26,500 virtual land"
857,aug-1614,technology,Google's toolbar sparks concern
858,aug-3206,sport,Greene sets sights on world title
859,aug-3335,sport,Henman to face Saulnier test
860,aug-2889,sport,Holmes back on form in Birmingham
861,aug-0763,business,Home loan approvals rising again
862,aug-0648,business,Huge rush for Jet Airways shares
863,aug-1226,technology,IBM puts cash behind Linux push
864,aug-2762,business,India unveils anti-poverty budget
865,aug-0319,sport,Injury doubts beset Wales squad
866,aug-3240,technology,"Intercom Are Doubling Their Product Teams In SF, Dublin & London"
867,aug-1817,sport,Ireland 19-13 England
868,aug-0781,sport,Ireland win eclipses refereeing 'errors'
869,aug-4887,business,Japan economy slides to recession
870,aug-4692,business,Japan's ageing workforce: built to last
871,aug-0685,business,Japanese growth grinds to a halt
872,aug-1101,business,Jobs go at Oracle after takeover
873,aug-1823,business,Jobs growth still slow in the US
874,aug-3199,sport,Johnson accuses British sprinters
875,aug-0176,business,LSE doubts boost bidders' shares
876,aug-1452,technology,Lasers help bridge network gaps
877,aug-3112,sport,Lewis-Francis turns to Christie
878,aug-0373,sport,Man City 0-2 Man Utd
879,aug-4936,sport,Man Utd women's team to be axed
880,aug-1558,business,Markets fall on weak dollar fears
881,aug-3754,business,Marsh executive in guilty plea
882,aug-2783,business,McDonald's boss Bell dies aged 44
883,aug-4587,sport,McIlroy wins 800m indoor title
884,aug-3962,business,Mexican in US send $16bn home
885,aug-0665,technology,Microsoft launches its own search
886,aug-3312,technology,Microsoft releases bumper patches
887,aug-2549,technology,Microsoft sets sights on spyware
888,aug-4009,business,Mixed Christmas for US retailers
889,aug-2180,business,Mixed reaction to Man Utd offer
890,aug-3857,sport,Murray to make Cup history
891,aug-3877,technology,Musical future for phones
892,aug-3101,technology,Net fingerprints combat attacks
893,aug-3408,technology,New browser wins over net surfers
894,aug-3126,business,News Corp eyes video games market
895,aug-2688,business,No seasonal lift for house market
896,aug-2601,sport,O'Sullivan quick to hail Italians
897,aug-1976,business,Online News poll indicates economic gloom
898,aug-4015,business,Parmalat boasts doubled profits
899,aug-4910,technology,PlayStation 3 processor unveiled
900,aug-1990,technology,Podcasts mark rise of DIY radio
901,aug-3360,business,Police detain Chinese milk bosses
902,aug-3213,sport,Poll explains free-kick decision
903,aug-3564,sport,Radcliffe proves doubters wrong
904,aug-4998,sport,Radcliffe will compete in London
905,aug-0801,sport,Roddick into San Jose final
906,aug-4456,sport,Ruddock backs Yapp's credentials
907,aug-4931,business,S&N extends Indian beer venture
908,aug-4232,sport,SA return to Mauritius
909,aug-1046,sport,Safin slumps to shock Dubai loss
910,aug-3940,business,Sales 'fail to boost High Street'
911,aug-4740,sport,Santini resigns as Spurs manager
912,aug-2812,sport,Serena ends Sania Mirza's dream
913,aug-0633,technology,Set your television to wow
914,aug-3280,business,Small firms 'hit by rising costs'
915,aug-4746,sport,Souness delight at Euro progress
916,aug-4220,sport,Stars shine for tsunami benefit
917,aug-1720,sport,Strachan turns down Pompey
918,aug-1390,business,Strong demand triggers oil rally
919,aug-2437,sport,Sydney to host north v south game
920,aug-1486,business,Telegraph newspapers axe 90 jobs
921,aug-2512,business,UK bank seals South Korean deal
922,aug-1933,business,UK homes hit £3.3 trillion total
923,aug-1337,business,US Airways staff agree to pay cut
924,aug-4172,business,US budget deficit to reach $368bn
925,aug-3301,business,US interest rates increased to 2%
926,aug-2517,technology,US woman sues over ink cartridges
927,aug-4672,sport,Uganda FA suspended
928,aug-0800,business,Ukraine strikes Turkmen gas deal
929,aug-0840,technology,Video phone help for deaf people
930,aug-4831,technology,Viewers to be able to shape TV
931,aug-2563,sport,WRU proposes season overhaul
932,aug-4625,business,Watchdog probes Vivendi bond sale
933,aug-1797,business,Weak data buffets French economy
934,aug-2487,sport,White prepared for battle
935,aug-0053,sport,Williams stays on despite dispute
936,aug-1767,business,Wipro beats forecasts once again
937,aug-3362,business,WorldCom bosses' $54m payout
938,aug-1146,sport,Young debut cut short by Ginepri
939,sep-1375,sport,Adriano's Chelsea link rejected
940,sep-3874,business,Alfa Romeos 'to get GM engines'
941,sep-0096,business,Amex shares up on spin-off news
942,sep-3814,technology,Apple attacked over sources row
943,sep-4619,sport,Aragones angered by racism fine
944,sep-3639,business,Asian banks halt dollar's slide
