,article_id,category,title
0,jan-0418,technology,21st-Century Sports: How Digital Technology Is Changing the Face Of The Sporting Industry
1,jan-0027,business,Asian quake hits European shares
2,jan-0631,technology,BT offers free net phone calls
3,jan-2105,business,Barclays shares up on merger talk
4,jan-3300,sport,Barkley fit for match in Ireland
5,jan-4187,sport,Bellamy under new fire
6,jan-1974,sport,Benitez 'to launch Morientes bid'
7,jan-3666,sport,Benitez delight after crucial win
8,jan-2629,technology,Big war games battle it out
9,jan-2415,technology,British Library gets wireless net
10,jan-4210,sport,Brizzel to run AAA's in Sheffield
11,jan-4789,business,Bush budget seeks deep cutbacks
12,jan-3452,business,Bush to get 'tough' on deficit
13,jan-2428,technology,Cable offers video-on-demand
14,jan-4766,technology,Cabs collect mountain of mobiles
15,jan-2595,technology,Camera phones are 'must-haves'
16,jan-2935,business,Card fraudsters 'targeting web'
17,jan-0578,business,Cash gives way to flexible friend
18,jan-3023,technology,Cebit opens to mobile music tune
19,jan-2356,sport,Charvis set to lose fitness bid
20,jan-1023,sport,Chelsea hold Arsenal
21,jan-0641,business,Christmas sales worst since 1981
22,jan-2461,sport,Clijsters set for February return
23,jan-4541,sport,Clyde 0-5 Celtic
24,jan-1259,sport,Coach Ranieri sacked by Valencia
25,jan-4007,technology,Confusion over high-definition TV
26,jan-4171,business,Cuba winds back economic clock
27,jan-0272,technology,DS aims to touch gamers
28,jan-4894,sport,Dawson set for new Wasps contract
29,jan-4504,business,Diageo to buy US wine firm
30,jan-1740,technology,Digital guru floats sub-$100 PC
31,jan-2390,business,EU aiming to fuel development aid
32,jan-4471,sport,England 17-18 France
33,jan-3978,business,Enron bosses in $168m payout
34,jan-2209,business,Euronext 'poised to make LSE bid'
35,jan-0858,business,Europe asks Asia for euro help
36,jan-3187,business,Europe blames US over weak dollar
37,jan-1282,business,Fannie Mae 'should restate books'
38,jan-3414,technology,Featured: 'Brainwave' cap controls computer
39,jan-2289,technology,Featured: 'Evil twin' fear for wireless net
40,jan-1899,technology,Featured: 'Friends fear' with lost mobiles
41,jan-3686,business,Featured: 'Post-Christmas lull' in lending
42,jan-3679,business,Fed warns of more US rate rises
43,jan-1469,sport,Federer forced to dig deep
44,jan-4815,sport,Ferguson puts faith in youngsters
45,jan-1761,business,GE sees 'excellent' world economy
46,jan-4519,business,GM issues 2005 profits warning
47,jan-0248,technology,Gangsters dominate gaming chart
48,jan-1280,sport,Gardener wins double in Glasgow
49,jan-0154,business,Gazprom 'in $36m back-tax claim'
50,jan-4182,business,German growth goes into reverse
51,jan-3155,business,Germany calls for EU reform
52,jan-0502,technology,Go-ahead for new internet names
53,jan-1027,sport,Greek duo cleared in doping case
54,jan-3810,sport,Hansen 'delays return until 2006'
55,jan-1481,sport,Henman & Murray claim LTA awards
56,jan-2551,sport,Henman decides to quit Davis Cup
57,jan-0989,technology,Hi-tech posters guide commuters
58,jan-0633,sport,Hodgson shoulders England blame
59,jan-1566,technology,Hollywood to sue net film pirates
60,jan-0791,sport,Holmes secures comeback victory
61,jan-2691,business,House prices suffer festive fall
62,jan-3650,sport,IAAF launches fight against drugs
63,jan-1867,business,India-Pakistan peace boosts trade
64,jan-2835,business,Iraqi voters turn to economic issues
65,jan-1079,sport,Jansen suffers a further setback
66,jan-4592,technology,Latest Opera browser gets vocal
67,jan-4111,business,Laura Ashley chief stepping down
68,jan-0599,technology,Learning to love broadband
69,jan-0969,technology,Mac Mini heralds mini revolution
70,jan-2042,business,Macy's owner buys rival for $11bn
71,jan-0050,business,Madagascar completes currency switch
72,jan-4860,sport,McLeish ready for criticism
73,jan-0180,technology,Mobile games come of age
74,jan-1582,technology,More power to the people says HP
75,jan-4456,sport,Mourinho sends out warning shot
76,jan-3002,sport,Moya suffers shock loss
77,jan-2380,sport,Moyes U-turn on Beattie dismissal
78,jan-3243,sport,Murray returns to Scotland fold
79,jan-3151,business,Mystery surrounds new Yukos owner
80,jan-2619,sport,Off-colour Gardener storms to win
81,jan-1811,business,Oil companies get Russian setback
82,jan-3831,sport,Owen may have to return home
83,jan-4567,sport,Pearce keen on succeeding Keegan
84,jan-3938,technology,Poles play with GameBoy 'blip-pop'
85,jan-4175,sport,Premier League probes Cole claims
86,jan-0237,sport,Prodigy Monfils blows away Gaudio
87,jan-0924,technology,Remote control rifle range debuts
88,jan-1731,sport,Robinson ready for difficult task
89,jan-3981,technology,Row brewing over peer-to-peer ads
90,jan-2769,sport,Rusedski angry over supplements
91,jan-2140,business,S Korean lender faces liquidation
92,jan-3329,sport,SFA awaits report over Mikoliunas
93,jan-1087,sport,Safin cool on Wimbledon
94,jan-0480,sport,Safin plays down Wimbledon hopes
95,jan-2591,technology,Satellite mapping aids Darfur relief
96,jan-2407,technology,Search sites get closer to users
97,jan-1520,technology,Security scares spark browser fix
98,jan-3036,business,Senior Fannie Mae bosses resign
99,jan-1051,technology,Solutions to net security fears
100,jan-2864,business,Split-caps pay £194m compensation
101,jan-4078,sport,Sports Stock Tips
102,jan-0269,business,Strong quarterly growth for Nike
103,jan-1728,technology,T-Mobile bets on 'pocket office'
104,jan-0976,sport,Thanou desperate to make return
105,jan-3315,sport,Thompson says Gerrard should stay
106,jan-3425,sport,Time to get tough on friendlies?
107,jan-1296,technology,US peer-to-peer pirates convicted
108,jan-4675,technology,US top of supercomputing charts
109,jan-3694,business,Venezuela and China sign oil deal
110,jan-1550,business,Weak end-of-year sales hit Next
111,jan-1587,sport,Williams says he will never quit
112,jan-0587,business,Winemaker rejects Foster's offer
113,jan-1650,business,Worldcom boss 'left books alone'
114,jan-0867,technology,Xbox 2 may be unveiled in summer
115,jan-0457,technology,Xbox power cable 'fire fear'
116,jan-2075,business,Yangtze Electric's profits double
117,jan-3244,business,Yukos loses US bankruptcy battle
118,feb-3392,business,7 business technology trends to watch
119,feb-0704,sport,A November to remember
120,feb-0913,technology,A question of trust and technology
121,feb-3975,business,Ad sales boost Time Warner profit
122,feb-0641,sport,African double in Edinburgh
123,feb-0608,business,Air passengers win new EU rights
124,feb-4436,technology,Anti-spam screensaver scrapped
125,feb-0930,sport,Arsenal through on penalties
126,feb-4492,business,BP surges ahead on high oil price
127,feb-4474,business,Bank holds interest rate at 4.75%
128,feb-4340,business,Bank set to leave rates on hold
129,feb-1116,sport,Bekele sets sights on world mark
130,feb-2873,sport,Bitter Santini hits out at Spurs
131,feb-2303,technology,Blogs take on the mainstream
132,feb-2977,business,Brewers' profits lose their fizz
133,feb-4547,business,Bush to outline 'toughest' budget
134,feb-3154,business,Buyers snap up Jet Airways' shares
135,feb-1466,business,Cairn shares up on new oil find
136,feb-3116,sport,Campbell to extend sprint career
137,feb-3641,sport,Celtic make late bid for Bellamy
138,feb-3724,sport,Charlton 1-2 Liverpool
139,feb-1553,sport,Chepkemei joins Edinburgh line-up
140,feb-0192,business,"Chinese billionaire targets Manchester United shares in new deal, reports suggest"
141,feb-2830,sport,Collins calls for Chambers return
142,feb-2366,technology,Commodore finds new lease of life
143,feb-3261,technology,Creator of first Apple Mac dies
144,feb-2526,sport,Cudicini misses Carling Cup final
145,feb-3097,sport,Davenport hits out at Wimbledon
146,feb-1454,sport,Davies favours Gloucester future
147,feb-0258,business,Deutsche Telekom sees mobile gain
148,feb-4548,sport,"Dibaba breaks 5,000m world record"
149,feb-0679,sport,Dogged Federer claims Dubai crown
150,feb-1000,business,Dollar hovers around record lows
151,feb-1821,sport,Dundee Utd 4-1 Aberdeen
152,feb-4494,business,EC calls truce in deficit battle
153,feb-0250,business,EU-US seeking deal on air dispute
154,feb-2382,business,Egypt and Israel seal trade deal
155,feb-4407,business,Egypt to sell off state-owned bank
156,feb-3768,sport,El Guerrouj targets cross country
157,feb-3375,sport,FA ready to test out goal bleeper
158,feb-2553,business,FBI agent colludes with analyst
159,feb-2750,technology,Fast moving phone bugs appear
160,feb-0829,sport,Ferguson fears Milan cutting edge
161,feb-3941,sport,Finnan says Irish can win group
162,feb-1333,sport,Fit-again Betsen in France squad
163,feb-3708,business,Five million Germans out of work
164,feb-1684,technology,Format wars could 'confuse users'
165,feb-4876,sport,Giggs handed Wales leading role
166,feb-1493,technology,Gritty return for Prince of Persia
167,feb-0113,sport,Hewitt survives Nalbandian epic
168,feb-2502,business,Honda wins China copyright ruling
169,feb-2351,business,India seeks to boost construction
170,feb-1245,business,India's Deccan gets more planes
171,feb-2809,business,Indy buys into India paper
172,feb-4569,business,Intercom raises €101m in funding round making it the most valuable Irish tech firm
173,feb-4323,business,Iranian MPs threaten mobile deal
174,feb-3937,business,Irish company hit by Iraqi report
175,feb-1582,sport,Italy aim to rattle England
176,feb-1312,business,Italy to get economic action plan
177,feb-2836,sport,Juninho demand for O'Neill talks
178,feb-0505,sport,Kenyon denies Robben Barca return
179,feb-3556,sport,Kerr frustrated at victory margin
180,feb-4691,sport,Klinsmann issues Lehmann warning
181,feb-4543,business,LSE 'sets date for takeover deal'
182,feb-3028,sport,Lewis-Francis eyeing world gold
183,feb-1960,technology,Lifestyle 'governs mobile choice'
184,feb-4127,technology,Looks and music to drive mobiles
185,feb-4247,sport,Man Utd through after Exeter test
186,feb-2114,sport,Martinez sees off Vinci challenge
187,feb-0571,technology,Microsoft makes anti-piracy move
188,feb-0451,sport,Middlesbrough 2-2 Charlton
189,feb-1201,sport,Mido makes third apology
190,feb-4578,technology,Millions buy MP3 players in US
191,feb-3474,business,Mixed signals from French economy
192,feb-4987,technology,Mobile picture power in your pocket
193,feb-4718,sport,Moore questions captaincy
194,feb-2135,sport,More Africans for tsunami game
195,feb-1118,sport,Murphy: That was a bruising battle
196,feb-4768,sport,Navratilova hits out at critics
197,feb-4017,sport,O'Driscoll out of Scotland game
198,feb-1005,sport,O'Gara revels in Ireland victory
199,feb-0504,sport,Owen dismisses fresh Real rumours
200,feb-1308,technology,PC ownership to 'double by 2010'
201,feb-2371,sport,Paris promise raises Welsh hopes
202,feb-3067,business,Parmalat sues 45 banks over crash
203,feb-1134,technology,Progress on new internet domains
204,feb-1004,business,Qantas considers offshore option
205,feb-0814,sport,Radcliffe tackles marathon tasks
206,feb-4229,sport,Rangers seal Old Firm win
207,feb-0630,sport,Record fails to lift lacklustre meet
208,feb-2030,business,Record year for Chilean copper
209,feb-1336,sport,Republic to face China and Italy
210,feb-3074,sport,Robben sidelined with broken foot
211,feb-1812,technology,Robots learn 'robotiquette' rules
212,feb-1149,technology,Rolling out next generation's net
213,feb-0800,business,Russia WTO talks 'make progress'
214,feb-2206,technology,Screensaver tackles spam websites
215,feb-0110,technology,Slim PlayStation triples sales
216,feb-3700,business,Standard Life concern at LSE bid
217,feb-4539,business,"Steel firm 'to cut' 45,000 jobs"
218,feb-0707,sport,Stuart joins Norwich from Addicks
219,feb-2055,technology,Sun offers processing by the hour
220,feb-4838,technology,Tech helps disabled speed demons
221,feb-2802,technology,Telewest to challenge Sky Plus
222,feb-2640,sport,Thanou bullish over drugs hearing
223,feb-4399,technology,The Force is strong in Battlefront
224,feb-0406,technology,The gaming world in 2005
225,feb-2304,business,Turkey knocks six zeros off lira
226,feb-2170,business,UK Coal plunges into deeper loss
227,feb-3783,business,US trade gap ballooned in October
228,feb-4402,business,Unilever shake up as profit slips
229,feb-1028,sport,Wales get Williams fitness boost
230,feb-2316,sport,Wales stars need a rest - Ruddock
231,feb-0243,business,Wall Street cool to eBay's profit
232,feb-2017,technology,Warnings about junk mail deluge
233,feb-2660,technology,Web radio takes Spanish rap global
234,feb-0224,sport,Wenger shock at Newcastle dip
235,feb-2955,technology,When invention turns to innovation
236,feb-4616,technology,Who do you think you are?
237,feb-0576,sport,Wilkinson to miss Ireland match
238,feb-0519,business,Winn-Dixie files for bankruptcy
239,feb-1952,business,Yukos sues four firms for $20bn
240,mar-1126,sport,A year to remember for Irish
241,mar-3331,sport,An Irish Athletics Year
242,mar-3141,sport,Arnesen denies rift with Santini
243,mar-3697,business,Asia shares defy post-quake gloom
244,mar-3655,business,Bank payout to Pinochet victims
245,mar-2120,sport,Barcelona title hopes hit by loss
246,mar-2380,business,Bargain calls widen Softbank loss
247,mar-1445,sport,Bayern Munich 3-1 Arsenal
248,mar-1627,sport,Benitez deflects blame from Dudek
249,mar-0220,technology,Blog reading explodes in America
250,mar-1595,technology,Broadband challenges TV viewing
251,mar-4085,technology,Broadband in the UK growing fast
252,mar-2495,sport,Calder fears for Scottish rugby
253,mar-4902,sport,Captains lining up for Aid match
254,mar-3484,sport,Celts savour Grand Slam prospect
255,mar-1905,sport,Chelsea ridiculed over complaint
256,mar-1702,business,China keeps tight rein on credit
257,mar-4607,technology,China net cafe culture crackdown
258,mar-4510,business,China suspends 26 power projects
259,mar-1543,business,Christmas shoppers flock to tills
260,mar-0210,sport,Collins named UK Athletics chief
261,mar-1989,technology,Court mulls file-sharing future
262,mar-4293,business,Crude oil prices back above $50
263,mar-0521,technology,Cyber criminals step up the pace
264,mar-3692,technology,DVD copy protection strengthened
265,mar-2874,business,Deutsche attacks Yukos case
266,mar-3420,sport,Disappointed Scott in solid start
267,mar-3360,business,Durex maker SSL awaits firm bid
268,mar-0037,technology,EA to take on film and TV giants
269,mar-2432,sport,Edu blasts Arsenal
270,mar-1244,technology,Europe backs digital TV lifestyle
271,mar-1251,sport,Farrell saga to drag on - Lindsay
272,mar-0183,business,Featured: 'Golden economic period' to end
273,mar-2000,business,Feta cheese battle reaches court
274,mar-3083,business,Firms pump billions into pensions
275,mar-3722,technology,First look at PlayStation 3 chip
276,mar-1165,business,Ford gains from finance not cars
277,mar-2123,sport,Fuming Robinson blasts officials
278,mar-3909,sport,GB quartet get cross country call
279,mar-0579,technology,Gadget market 'to grow in 2005'
280,mar-3023,technology,Gadgets galore on show at fair
281,mar-0977,technology,Games help you 'learn and play'
282,mar-4216,business,Gaming firm to sell UK dog tracks
283,mar-2195,business,Germany nears 1990 jobless level
284,mar-4576,sport,Greek pair attend drugs hearing
285,mar-2382,sport,Gronkjaer agrees switch to Madrid
286,mar-0012,technology,Half of UK's mobiles 'go online'
287,mar-4343,sport,Hantuchova in Dubai last eight
288,mar-3567,technology,Have hackers recruited your PC?
289,mar-1674,sport,Healey targets England comeback
290,mar-3810,business,High fuel costs hit US airlines
291,mar-3301,business,High fuel prices hit BA's profits
292,mar-2795,technology,Hotspot users gain free net calls
293,mar-3037,business,House prices drop as sales slow
294,mar-1629,business,House prices show slight increase
295,mar-0481,technology,ITunes user sues Apple over iPod
296,mar-0388,business,India widens access to telecoms
297,mar-1453,technology,Iran jails blogger for 14 years
298,mar-1606,business,Irish duo could block Man Utd bid
299,mar-1230,sport,Italy 8-38 Wales
300,mar-3153,sport,Johnson uncertain about Euro bid
301,mar-0170,sport,Kirwan demands Italy consistency
302,mar-4481,business,Liberian economy starts to grow
303,mar-4754,business,Malaysia lifts Islamic bank limit
304,mar-3612,sport,Man Utd stroll to Cup win
305,mar-3927,technology,Man auctions ad space on forehead
306,mar-4340,business,Manufacturing recovery 'slowing'
307,mar-1335,business,Markets signal Brazilian recovery
308,mar-2040,sport,Merritt close to indoor 400m mark
309,mar-0033,technology,Microsoft debuts security tools
310,mar-2536,technology,Microsoft releases patches
311,mar-4512,business,Minister hits out at Yukos sale
312,mar-4615,sport,Mirza shocks Kuznetsova
313,mar-4246,sport,Mourinho receives Robson warning
314,mar-4861,sport,Moya emotional after Davis Cup win
315,mar-4279,business,Nasdaq planning $100m share sale
316,mar-4599,sport,Newcastle 2-1 Bolton
317,mar-2276,sport,Newcastle to join Morientes race
318,mar-1739,business,News Corp makes $5.4bn Fox offer
319,mar-4407,business,Nigeria to boost cocoa production
320,mar-3144,technology,Nintendo DS aims to touch gamers
321,mar-0182,business,Novartis hits acquisition trail
322,mar-2488,business,Profits stall at China's Lenovo
323,mar-4584,business,Putin backs state grab for Yukos
324,mar-4102,business,Quiksilver moves for Rossignol
325,mar-3792,sport,Redknapp poised for Saints
326,mar-0131,sport,Robertson out to retain Euro lure
327,mar-4398,technology,Seamen sail into biometric future
328,mar-0463,business,Singapore growth at 8.1% in 2004
329,mar-0029,sport,Slovakia reach Hopman Cup final
330,mar-4749,sport,Sociedad set to rescue Mladenovic
331,mar-3392,technology,Sony wares win innovation award
332,mar-0952,business,Soros group warns of Kazakh close
333,mar-1203,technology,Sport-loving inventors whose tech could change the game
334,mar-2048,sport,Sprinter Walker quits athletics
335,mar-3318,business,Stock market eyes Japan recovery
336,mar-2788,business,Swiss cement firm in buying spree
337,mar-4562,technology,Text message record smashed
338,mar-0620,technology,The pirates with no profit motive
339,mar-4001,business,Tsunami to cost Sri Lanka $1.3bn
340,mar-1599,sport,UK Athletics agrees new kit deal
341,mar-2785,technology,US cyber security chief resigns
342,mar-1454,technology,US hacker breaks into T-Mobile
343,mar-1913,business,US industrial output growth eases
344,mar-4140,business,"US insurer Marsh cuts 2,500 jobs"
345,mar-4357,business,US manufacturing expands
346,mar-4898,business,US to rule on Yukos refuge call
347,mar-0550,sport,Van Nistelrooy set to return
348,mar-2508,sport,Vickery upbeat about arm injury
349,mar-2039,technology,Video phones act as dating tools
350,mar-4111,business,Virgin Blue shares plummet 20%
351,mar-4582,sport,Wada will appeal against ruling
352,mar-3651,sport,Wales critical of clumsy Grewcock
353,mar-3663,sport,Wales silent on Grand Slam talk
354,mar-4500,sport,Wenger rules out new keeper
355,mar-1916,sport,Wenger signs new deal
356,apr-1897,business,Axa Sun Life cuts bonus payments
357,apr-2967,technology,BT boosts its broadband packages
358,apr-2939,sport,Bates seals takeover
359,apr-0145,technology,Beckham virus spotted on the net
360,apr-1938,technology,Broadband fuels online expression
361,apr-1748,technology,Broadband in the UK gathers pace
362,apr-2559,business,Burren awarded Egyptian contracts
363,apr-1306,business,Business fears over sluggish EU economy
364,apr-2454,sport,Candela completes Bolton switch
365,apr-0039,business,Cannabis hopes for drug firm
366,apr-1044,sport,Castaignede fires Laporte warning
367,apr-2151,technology,Casual gaming to 'take off'
368,apr-2808,sport,Chelsea sack Mutu
369,apr-4324,business,China Aviation seeks rescue deal
370,apr-2873,sport,Classy Henman makes winning start
371,apr-4741,sport,Collins banned in landmark case
372,apr-0433,technology,Concerns over Windows ATMs
373,apr-4890,sport,Connors boost for British tennis
374,apr-4575,business,Crossrail link 'to get go-ahead'
375,apr-0228,technology,Cyber crime booms in 2004
376,apr-4827,technology,Disney backs Sony DVD technology
377,apr-1926,business,Dollar slides ahead of New Year
378,apr-1571,business,Economy 'stronger than forecast'
379,apr-1904,business,Electrolux to export Europe jobs
380,apr-3933,business,Ethiopia's crop production up 24%
381,apr-4960,sport,FA charges Liverpool and Millwall
382,apr-4241,sport,FA probes crowd trouble
383,apr-4901,technology,Format wars could 'confuse users'
384,apr-0724,business,GM in crunch talks on Fiat future
385,apr-4907,technology,Game makers get Xbox 2 sneak peek
386,apr-3088,technology,Gamers could drive high-definition
387,apr-0395,technology,Google launches TV search service
388,apr-4460,sport,Harinordoquy suffers France axe
389,apr-0524,sport,Hearts of Oak 3-2 Cotonsport
390,apr-3536,sport,Hodges announces rugby retirement
391,apr-4694,sport,Holmes feted with further honour
392,apr-3827,technology,Honour for UK games maker
393,apr-2270,sport,Houllier praises Benitez regime
394,apr-0205,technology,Humanoid robot learns how to run
395,apr-1858,sport,Ireland v USA (Sat)
396,apr-3390,sport,Isinbayeva heads for Birmingham
397,apr-3841,sport,Israeli club look to Africa
398,apr-4467,technology,Junk e-mails on relentless rise
399,apr-3842,sport,Kluft impressed by Sotherton form
400,apr-3718,business,Latin America sees strong growth
401,apr-0784,business,Libya takes $1bn in unfrozen funds
402,apr-2677,technology,Loyalty cards idea for TV addicts
403,apr-3475,sport,Man City 1-1 Newcastle
404,apr-2558,sport,McCall earns Tannadice reprieve
405,apr-2706,sport,McClaren eyes Uefa Cup top spot
406,apr-4921,sport,McClaren hails Boro's Uefa spirit
407,apr-0240,sport,McIlroy aiming for Madrid title
408,apr-2106,technology,Microsoft makes anti-piracy move
409,apr-0622,technology,Microsoft seeking spyware trojan
410,apr-4699,business,Mild winter drives US oil down 6%
411,apr-4622,technology,Millions to miss out on the net
412,apr-2061,sport,Minister digs in over doping row
413,apr-0646,sport,Mirza makes Indian tennis history
414,apr-4064,business,Mitsubishi in Peugeot link talks
415,apr-4854,technology,Mobile multimedia slow to catch on
416,apr-4446,technology,Mobiles 'not media players yet'
417,apr-0150,sport,Morientes admits to Reds struggle
418,apr-3146,sport,Mourinho plots impressive course
419,apr-1270,sport,Mourinho says race is almost over
420,apr-2879,sport,Moya sidesteps Davis Cup in 2005
421,apr-1276,sport,Nadal marches on in Mexico
422,apr-0061,technology,Nintendo adds media playing to DS
423,apr-1620,sport,O'Connell rejects Lions rumours
424,apr-2704,sport,O'Driscoll concern at Fifa ruling
425,apr-4823,business,Oil prices fall back from highs
426,apr-0564,business,Ore costs hit global steel firms
427,apr-0338,sport,Parry relishes Anfield challenge
428,apr-4399,business,Peugeot deal boosts Mitsubishi
429,apr-4686,technology,PlayStation 3 chip to be unveiled
430,apr-2813,technology,Portable PlayStation ready to go
431,apr-0953,sport,Premier League planning Cole date
432,apr-2019,business,Qantas sees profits fly to record
433,apr-0042,sport,Radcliffe yet to answer GB call
434,apr-4569,sport,Redknapp's Saints face Pompey tie
435,apr-2560,sport,Reds sink 10-man Magpies
436,apr-1918,business,Reliance unit loses Anil Ambani
437,apr-0857,technology,Rich pickings for hi-tech thieves
438,apr-0028,sport,Robinson out of Six Nations
439,apr-1068,sport,Rovers reject third Ferguson bid
440,apr-4171,sport,Saint-Andre anger at absent stars
441,apr-4618,business,Salary scandal in Cameroon
442,apr-1300,technology,Slimmer PlayStation triple sales
443,apr-1815,sport,Slovakia seal Hopman Cup success
444,apr-3833,technology,Smart search lets art fans browse
445,apr-1205,sport,Smith keen on Home series return
446,apr-3471,sport,South Africa sweep top awards
447,apr-4435,technology,Speak easy plan for media players
448,apr-0484,technology,Speech takes on search engines
449,apr-1009,business,Tokyo says deflation 'controlled'
450,apr-0361,business,Turkey turns on the economic charm
451,apr-4474,business,Turkey-Iran mobile deal 'at risk'
452,apr-3423,business,UK 'risks breaking golden rule'
453,apr-3100,business,UK firm faces Venezuelan land row
454,apr-0865,technology,UK pioneers digital film network
455,apr-0134,business,US bank in $515m SEC settlement
456,apr-2219,business,US crude prices surge above $53
457,apr-0182,sport,Umaga ready for Lions
458,apr-4228,business,Umbro profits lifted by Euro 2004
459,apr-3753,technology,Virgin Radio offers 3G broadcast
460,apr-2040,technology,Virus poses as Christmas e-mail
461,apr-4036,technology,Voters flock to blog awards site
462,apr-4395,sport,Wales want rugby league training
463,apr-4277,sport,Wales win in Rome
464,apr-1102,technology,Warning over tsunami aid website
465,apr-3992,sport,Wolves appoint Hoddle as manager
466,apr-3250,sport,Wood - Ireland can win Grand Slam
467,apr-4031,business,World leaders gather to face uncertainty
468,apr-0896,sport,Worthington praises classy Villa
469,apr-3567,sport,Yachvili savours France comeback
470,apr-3586,business,Yukos heading back to US courts
471,apr-4951,business,Yukos seeks court action on sale
472,apr-0345,business,Yukos unit fetches $9bn at auction
473,may-0284,business,Air China in $1bn London listing
474,may-3980,sport,Angry Williams rejects criticism
